Form Number,Form Title,Page URL,Fileable Online,Short Description,Long Description,File Name,File URL,Extra Files
AR-11,Alien’s Change of Address Card,https://www.uscis.gov/ar-11,False,,"All noncitizens in the United States must report a change of address to USCIS within 10 days (except A and G visa holders and visa waiver visitors) of moving. Timely reporting a change of address also helps to ensure that we mail important notices and documents to the right place. You can change your address with USCIS through your online account or by filing a paper AR-11, Alien’s Change of Address Card. You can find detailed information about how to change an address on the How to Change Your Address page. Please visit our How To Change Your Address page for additional information. ",ar-11.pdf,https://www.uscis.gov/sites/default/files/document/forms/ar-11.pdf,{}
EOIR-29,Notice of Appeal to the Board of Immigration Appeals from a Decision of a DHS Officer,https://www.uscis.gov/eoir-29,False,,"Use this form to appeal a USCIS decision on a Form I-130 or Form I-360 Widow(er).Note: An attorney or an accredited representative of an organization recognized by the Board of Immigration Appeals must file a separate notice of appearance on behalf of the petitioner (Form EOIR-27) with EOIR-29. Do not use this form to appeal a Department of State overseas consular officer's denial of your visa application (for example, DS-157, DS-230, or DS-260). For information about visa application denials, please reference the Department of State website.",eoir-29.pdf,https://www.uscis.gov/sites/default/files/document/forms/eoir-29.pdf,{}
G-1041,Genealogy Index Search Request,https://www.uscis.gov/g-1041,False,,"Alert: Before sending your package to USCIS, make sure that all the forms you have completed are the current acceptable edition. USCIS published new editions for most forms on April 1, 2024. If you downloaded or printed your forms before April 1, you should verify the current edition date, because we will no longer accept a prior edition. The current acceptable edition can be found under the Edition Date section listed on each form’s webpage. You can also find the edition date at the bottom of the page on the form and instructions. For each form that you are submitting, make sure that all pages are from the same form edition. If any of the form’s pages are from a different form edition, we may reject your form. Watch USCIS Forms: Download the most recent version! to see how to ensure your form is acceptable. For additional guidance on filing paper-based forms at the Lockbox and how to avoid or correct common errors before you file, please visit the Five Steps to File at the USCIS Lockbox webpage. Use this form to request a search of USCIS historical indices. (To obtain copies of USCIS historical records, use Form G-1041A, Genealogy Records Request.) When we receive your request, we will determine whether any USCIS records exist on the subject and, if such records exist, will capture the file number and other identifiers of each record.",g-1041.pdf,https://www.uscis.gov/sites/default/files/document/forms/g-1041.pdf,{'g-1041instr.pdf': 'https://www.uscis.gov/sites/default/files/document/forms/g-1041instr.pdf'}
G-1041A,Genealogy Records Request,https://www.uscis.gov/g-1041a,False,,"Alert: Before sending your package to USCIS, make sure that all the forms you have completed are the current acceptable edition. USCIS published new editions for most forms on April 1, 2024. If you downloaded or printed your forms before April 1, you should verify the current edition date, because we will no longer accept a prior edition. The current acceptable edition can be found under the Edition Date section listed on each form’s webpage. You can also find the edition date at the bottom of the page on the form and instructions. For each form that you are submitting, make sure that all pages are from the same form edition. If any of the form’s pages are from a different form edition, we may reject your form. Watch USCIS Forms: Download the most recent version! to see how to ensure your form is acceptable. For additional guidance on filing paper-based forms at the Lockbox and how to avoid or correct common errors before you file, please visit the Five Steps to File at the USCIS Lockbox webpage. Use this form to obtain copies of USCIS historical records. (To request an index search of USCIS historical records, use Form G-1041, Genealogy Index Search Request.)",g-1041a.pdf,https://www.uscis.gov/sites/default/files/document/forms/g-1041a.pdf,{'g-1041ainstr.pdf': 'https://www.uscis.gov/sites/default/files/document/forms/g-1041ainstr.pdf'}
G-1055,Fee Schedule,https://www.uscis.gov/g-1055,False,,"ALERT: On July 31, 2024, we published a new edition of Form G-1055, Fee Schedule. The new edition, 07/31/24, clarifies fee exemptions and filing fee information for forms I-131 and I-765. ALERT: On Jan. 31, 2024, we published a final rule to adjust certain immigration and naturalization benefit request fees for the first time since 2016. The new filing fees are effective for filings postmarked April 1, 2024, and later. For more information, please visit our Frequently Asked Questions page. Use this form to verify fee information for immigration forms.Each application, petition, or request must be accompanied by the correct fee(s) unless you are exempt from paying the fee(s) or are eligible for a fee waiver. If the fee is incorrect, your application, petition, or request will be rejected.Fee Exemptions. Fee-exempt forms and filing categories list $0 as the Filing Fee. You do not need file Form I-912, Request for Fee Waiver, or make a formal request to qualify for a fee exemption. However, the fee exemptions in this schedule only indicate that the form is free to file. They do not indicate eligibility to file those benefit requests in all circumstances. Eligibility to file a particular benefit request is set forth in the applicable regulations and form instructions. Edition Date 07/31/24. You can find the edition date at the bottom of the page of Form G-1055, Fee Schedule. Downloads USCIS Fee Schedule (PDF, 1.08 MB) If you need help downloading and printing forms, read our instructions. ",g-1055.pdf,https://www.uscis.gov/sites/default/files/document/forms/g-1055.pdf,{}
G-1145,E-Notification of Application/Petition Acceptance,https://www.uscis.gov/g-1145,False,,Use this form to request a text message and/or email when USCIS accepts your form.,g-1145.pdf,https://www.uscis.gov/sites/default/files/document/forms/g-1145.pdf,{}
G-1256,Declaration for Interpreted USCIS Interview,https://www.uscis.gov/g-1256,False,,IMPORTANT: Do not sign the form before the interview. You and the interpreter must sign the form in the presence of the interviewing officer. The interviewing officer uses this form to:,g-1256.pdf,https://www.uscis.gov/sites/default/files/document/forms/g-1256.pdf,{'g-1256instr.pdf': 'https://www.uscis.gov/sites/default/files/document/forms/g-1256instr.pdf'}
G-1450,Authorization for Credit Card Transactions,https://www.uscis.gov/g-1450,False,,"You may pay your filing fee and biometric services fee, if applicable, with a credit card issued by a U.S. bank, if you are filing: There is no additional cost to file by credit card. We cannot accept a credit card issued by a foreign bank.",g-1450.pdf,https://www.uscis.gov/sites/default/files/document/forms/g-1450.pdf,{'g-1450instr.pdf': 'https://www.uscis.gov/sites/default/files/document/forms/g-1450instr.pdf'}
G-1566,Request for Certificate of Non-Existence,https://www.uscis.gov/g-1566,False,,"Use Form G-1566 to determine if specific immigration records exist within our database. If we determine the records you inquired about do not exist, we will issue a Certificate of Non-Existence. If we find the immigration record you inquired about, we will respond with additional information and will not issue a Certificate of Non-Existence.",g-1566.pdf,https://www.uscis.gov/sites/default/files/document/forms/g-1566.pdf,{'g-1566instr.pdf': 'https://www.uscis.gov/sites/default/files/document/forms/g-1566instr.pdf'}
G-28,Notice of Entry of Appearance as Attorney or Accredited Representative,https://www.uscis.gov/g-28,False,,"Use this form to provide information about your eligibility to act on behalf of an applicant, petitioner, or respondent.",g-28.pdf,https://www.uscis.gov/sites/default/files/document/forms/g-28.pdf,{'g-28instr.pdf': 'https://www.uscis.gov/sites/default/files/document/forms/g-28instr.pdf'}
G-28I,Notice of Entry of Appearance as Attorney in Matters Outside the Geographical Confines of the United States,https://www.uscis.gov/g-28i,False,,Use this form to provide notice that an attorney admitted to practice of the law in a country other than the United States seeks to appear before DHS in a matter outside the geographical confines of the United States.,g-28i.pdf,https://www.uscis.gov/sites/default/files/document/forms/g-28i.pdf,{'g-28iinstr.pdf': 'https://www.uscis.gov/sites/default/files/document/forms/g-28iinstr.pdf'}
G-325A,Biographic Information (for Deferred Action),https://www.uscis.gov/g-325a,False,,"Use this form to provide biographic information when submitting a request for deferred action for certain military service members and their family members, or for non-military deferred action (other than deferred action based on Deferred Action for Childhood Arrivals (DACA), Violence Against Women Act, A-3, G-5 nonimmigrants, and T and U nonimmigrant visas). ",g-325a.pdf,https://www.uscis.gov/sites/default/files/document/forms/g-325a.pdf,{'g-325ainstr.pdf': 'https://www.uscis.gov/sites/default/files/document/forms/g-325ainstr.pdf'}
G-845,Verification Request,https://www.uscis.gov/g-845,False,,"Use this form to verify an applicant’s immigration status when they are applying for federal, state, or local public benefits and licenses.",g-845.pdf,https://www.uscis.gov/sites/default/files/document/forms/g-845.pdf,{'g-845instr.pdf': 'https://www.uscis.gov/sites/default/files/document/forms/g-845instr.pdf'}
G-845 Supplement,Verification Request,https://www.uscis.gov/g-845-supplement,False,,"Use this form to request detailed information on an individual’s immigration status, citizenship, and sponsorship.",g-845sup.pdf,https://www.uscis.gov/sites/default/files/document/forms/g-845sup.pdf,{'g-845supinstr.pdf': 'https://www.uscis.gov/sites/default/files/document/forms/g-845supinstr.pdf'}
G-884,Request for the Return of Original Documents,https://www.uscis.gov/g-884,False,,Use this form to request that USCIS return original documents that you submitted to establish eligibility for an immigration benefit.,g-884.pdf,https://www.uscis.gov/sites/default/files/document/forms/g-884.pdf,{'g-884instr.pdf': 'https://www.uscis.gov/sites/default/files/document/forms/g-884instr.pdf'}
I-102,Application for Replacement/Initial Nonimmigrant Arrival-Departure Document,https://www.uscis.gov/i-102,False,,"Use this form if you are a nonimmigrant and need to apply for a new or replacement Form I-94 or Form I-95, Nonimmigrant Arrival-Departure Document.",i-102.pdf,https://www.uscis.gov/sites/default/files/document/forms/i-102.pdf,{'i-102instr.pdf': 'https://www.uscis.gov/sites/default/files/document/forms/i-102instr.pdf'}
I-129,Petition for a Nonimmigrant Worker,https://www.uscis.gov/i-129,False,,"ALERT: Important Filing Deadline Information for FY2025 H-1B Cap Subject Petitions The deadline for filing H-1B cap subject petitions online, based on a valid registration selection notice, is June 30, 2024. Because June 30 falls on a Sunday, consistent with USCIS policy, USCIS will consider properly filed paper H-1B cap subject petitions received at a USCIS Lockbox Facility on July 1, 2024, as timely filed (i.e., USCIS will consider the paper-filed H-1B petitions to have been received on June 30). ALERT: At intake, we determine whether the payment you submitted matches the correct fees due. If you do not submit the correct fee, we must reject your form, even if you have submitted an overpayment. The required fees for Form I-129, Form I-129CW, and Form I-140 depend on how you answer the form’s questions about your status as a nonprofit or small employer. See our Web Alert for more information: USCIS Reminds Certain Employment-Based Petitioners to Submit the Correct Required Fees. You can find additional filing fee information by visiting our Filing Fees page, our Form G-1055, Fee Schedule, and our Frequently Asked Questions on the USCIS Fee Rule page. ALERT: As of April 1, 2024, USCIS service centers are no longer accepting Form I-129 petitions requesting H-1B or H-1B1 (HSC) classification. We will reject H-1B or H-1B1 (HSC) petitions received at a USCIS service center on or after April 1, 2024. There will be no grace period provided. As of April 1, 2024, all paper-filed Form I-129 petitions requesting H-1 or H-1B1 (HSC) classification, including those with a concurrent Form I-907, Request for Premium Processing Service, and those with concurrently filed Form I-539 and/or Form I-765, must be filed at a USCIS lockbox facility. You can find the lockbox filing addresses for paper-filed forms on our Form I-129 Direct Filing Addresses page. If you are filing Form I-129 alone or with Form I-907, you may also file online. On March 25, USCIS launched online filing of Form I-129 and associated Form I-907 for non-cap H-1B petitions. On April 1, USCIS began accepting online filing for H-1B cap petitions and associated Forms I-907 for petitioners whose registrations have been selected. To file online, visit myaccount.uscis.gov. In addition, on Feb. 28, 2024, USCIS launched new USCIS organizational accounts that allow multiple people within a company and their legal representatives to collaborate and prepare H-1B registrations, online H-1B petitions, and associated online requests for premium processing. ALERT: If you are an H-1B or an L-1 nonimmigrant and your dependent spouse or child is applying for an extension of their existing H-4 or L-2 status, or a change of status to H-4 or L-2, we will adjudicate your dependent spouse or child’s application together with your Form I-129 if the Form I-539 is packaged together with and properly filed at the same time and in the same location as your Form I-129. This means that an officer will review the H-4 or L-2 derivative’s Form I-539 after reviewing the principal’s Form I-129 and will take appropriate adjudicative action (that is, issue an approval, denial, RFE, NOID or refer for an investigation) after that adjudicative review. This includes a Form I-765 filed by your dependent spouse for an employment authorization document based on H-4 or L-2 status, as applicable. If your dependent’s associated applications are not properly submitted together with your Form I-129, we will adjudicate them separately. Petitioners use this form to file on behalf of a nonimmigrant worker to come to the United States temporarily to perform services or labor, or to receive training, as an H-1B, H-2A, H-2B, H-3, L-1, O-1, O-2, P-1, P-1S, P-2, P-2S, P-3, P-3S, Q-1 or R-1 nonimmigrant worker. Petitioners may also use this form to request an extension of stay in or change of status to E-1, E-2, E-3, H-1B1 or TN, or one of the above classifications for a noncitizen. File Online ",i-129.pdf,https://www.uscis.gov/sites/default/files/document/forms/i-129.pdf,"{'m-1097.pdf': 'https://www.uscis.gov/sites/default/files/document/forms/m-1097.pdf', 'm-746.pdf': 'https://www.uscis.gov/sites/default/files/document/forms/m-746.pdf', 'i-129instr.pdf': 'https://www.uscis.gov/sites/default/files/document/forms/i-129instr.pdf', 'm-1087.pdf': 'https://www.uscis.gov/sites/default/files/document/forms/m-1087.pdf', 'm-735.pdf': 'https://www.uscis.gov/sites/default/files/document/forms/m-735.pdf', 'm-736.pdf': 'https://www.uscis.gov/sites/default/files/document/forms/m-736.pdf'}"
I-129CW,Petition for a CNMI-Only Nonimmigrant Transitional Worker,https://www.uscis.gov/i-129cw,False,,"ALERT: At intake, we determine whether the payment you submitted matches the correct fees due. If you do not submit the correct fee, we must reject your form, even if you have submitted an overpayment. The required fees for Form I-129, Form I-129CW, and Form I-140 depend on how you answer the form’s questions about your status as a nonprofit or small employer. See our Web Alert for more information: USCIS Reminds Certain Employment-Based Petitioners to Submit the Correct Required Fees. You can find additional filing fee information by visiting our Filing Fees page, our G-1055, Fee Schedule, and our Frequently Asked Questions on the USCIS Fee Rule page. An employer uses this form to petition for a noncitizen employee who is ineligible for another employment-based nonimmigrant classification to work as a nonimmigrant in the Commonwealth of the Northern Mariana Islands (CNMI) temporarily as a CW-1, CNMI-only transitional worker.",i-129cw.pdf,https://www.uscis.gov/sites/default/files/document/forms/i-129cw.pdf,{'i-129cwinstr.pdf': 'https://www.uscis.gov/sites/default/files/document/forms/i-129cwinstr.pdf'}
I-129CWR,Semiannual Report for CW-1 Employers,https://www.uscis.gov/i-129cwr,False,,"An employer of an approved Form I-129CW, Petition for Commonwealth of Northern Mariana Islands (CNMI) Only Transitional Worker (CW-1), uses Form I-129CWR to verify the continued employment and payment of each worker under the terms and conditions of the approved petition. During the validity of the petition, employers are required to file this report with USCIS every six months after the petition validity start date. USCIS may revoke the employer’s approved petition or deny their future petitions if they do not comply with the reporting requirement.",i-129cwr.pdf,https://www.uscis.gov/sites/default/files/document/forms/i-129cwr.pdf,{'i-129cwrinstr.pdf': 'https://www.uscis.gov/sites/default/files/document/forms/i-129cwrinstr.pdf'}
I-129F,Petition for Alien Fiancé(e),https://www.uscis.gov/i-129f,False,,"Alert: Before sending your package to USCIS, make sure that all the forms you have completed are the current acceptable edition. USCIS published new editions for most forms on April 1, 2024. If you downloaded or printed your forms before April 1, you should verify the current edition date, because we will no longer accept a prior edition. The current acceptable edition can be found under the Edition Date section listed on each form’s webpage. You can also find the edition date at the bottom of the page on the form and instructions. For each form that you are submitting, make sure that all pages are from the same form edition. If any of the form’s pages are from a different form edition, we may reject your form. Watch USCIS Forms: Download the most recent version! to see how to ensure your form is acceptable. For additional guidance on filing paper-based forms at the Lockbox and how to avoid or correct common errors before you file, please visit the Five Steps to File at the USCIS Lockbox webpage. Use this form to petition to bring your: How to Report Suspected Marriage FraudU.S. Immigration and Customs Enforcement (ICE) has an online tip form to report suspected benefit/marriage fraud or other violations. Help for Immigration Crime VictimsDifferent types of support are available through ICE’s Victims of Immigration Crime Engagement (VOICE) Office.",i-129f.pdf,https://www.uscis.gov/sites/default/files/document/forms/i-129f.pdf,{'i-129finstr.pdf': 'https://www.uscis.gov/sites/default/files/document/forms/i-129finstr.pdf'}
I-129S,Nonimmigrant Petition Based on Blanket L Petition,https://www.uscis.gov/i-129s,False,,"Use this form to classify noncitizen employees as L-1 nonimmigrant intracompany transferees (executives, managers, or specialized knowledge professionals) under a previously approved blanket L petition.",i-129s.pdf,https://www.uscis.gov/sites/default/files/document/forms/i-129s.pdf,{'i-129sinstr.pdf': 'https://www.uscis.gov/sites/default/files/document/forms/i-129sinstr.pdf'}
I-130,Petition for Alien Relative,https://www.uscis.gov/i-130,False,,"Alert: If you are filing Form I-130 on behalf of your Afghan national relative whose country of birth in Part 4, Item 7, is not Afghanistan, please write “OAW” at the top of your Form I-130 to be considered for a fee exemption that is effective through Sept. 30, 2024. For those petitioners that wish to be considered for the fee exemption and whose Afghan national relative was not born in Afghanistan, you cannot submit your petition online. You must complete a paper version of Form I-130 (PDF, 715.81 KB) and follow the instructions for filing the Form I-130 by mail (paper). Use this form if you (the petitioner) are a U.S. citizen, lawful permanent resident, or U.S. national and you need to establish your qualifying relationship with an eligible relative (the beneficiary) who wishes to come to or stay in the United States permanently and apply for the Permanent Resident Card (also called a Green Card). You must select only 1 option for Part 4 (Question 61 or 62) to indicate whether the beneficiary will seek adjustment of status inside the United States or consular processing abroad. Do not complete both questions, and do not leave this section blank. File Online Processing Information Submitting Form I-130, Petition for Alien Relative, is the first step to help an eligible relative apply to immigrate to the United States and apply for a Green Card. The filing or approval of this petition does not give your relative any immigration status or benefit. We will generally approve your Form I-130 if you can establish a qualifying relationship between you and your relative that allows them to immigrate to the United States. Generally, after we approve the petition, your relative may apply for a Green Card. If your relative is already in the United States and an immigrant visa is available, they may be eligible to apply for their Green Card by filing Form I-485, Application to Register Permanent Residence or Adjust Status. Certain relatives must wait until an immigrant visa number is available before they can file Form I-485 (to adjust their status if they are in the United States) or request an immigrant visa at an embassy or consulate through consular processing (if they are outside the United States). However, if your relative qualifies as an immediate relative, an immigrant visa is always available. If your relative is already in the United States but they are not eligible to apply for the Green Card by filing Form I-485, the relative may be eligible to apply for an immigrant visa with the U.S. Department of State at a U.S. embassy or consulate through consular processing. For more information on eligibility and the process to apply for a Green Card, please visit our Green Card Eligibility Categories page. When you complete Form I-130, please make sure that you (the petitioner) select 1 and only 1 option indicating whether the beneficiary requests adjustment of status inside the United States or consular processing outside the United States. If the Form I-130 is still pending with USCIS and you want to change your selection (either to consular processing outside the United States or to adjustment of status in the United States), you may contact the USCIS Contact Center and request a change. If you want to change your selection to consular processing after we have already approved your petition, you may need to file Form I-824, Application for Action on an Approved Application or Petition. How to Report Suspected Marriage Fraud: We encourage you to report suspected immigration benefit fraud and abuse, including marriage fraud. For more information, please visit our Reporting Fraud page. Help for victims of abuse If you are the spouse, child, or parent of a U.S. citizen who has abused you, or the spouse or child of a lawful permanent resident who has abused you, you may be eligible to file a petition for yourself independent from your U.S. citizen or lawful permanent resident abuser. For more information, go to the Abused Spouses, Children, and Parents (Form I-360 VAWA Self-Petitioners) webpage.",i-130.pdf,https://www.uscis.gov/sites/default/files/document/forms/i-130.pdf,"{'i-130a.pdf': 'https://www.uscis.gov/sites/default/files/document/forms/i-130a.pdf', 'i-130instr.pdf': 'https://www.uscis.gov/sites/default/files/document/forms/i-130instr.pdf'}"
