Form Number,Form Title,Page URL,Fileable Online,Short Description,Long Description,File Name,File URL,Extra Files
I-131,Application for Travel Document,https://www.uscis.gov/i-131,False,,"ALERT: On Feb. 27, 2024, we announced a process for eligible Ukrainian citizens and their immediate family members to apply for re-parole so they can continue to temporarily remain in the United States. We encourage eligible Ukrainian citizens and their immediate family members to submit their re-parole requests to us no earlier than 180 days (6 months) before the expiration of their current period of parole. You can find your parole expiration date on your Form I-94, Arrival/Departure Record, issued by U.S. Customs and Border Protection when you were paroled into the United States. Filing during this window reduces the risk that your current period of parole and employment authorization will expire before you receive a decision on your re-parole request. If you submit a request for re-parole more than 180 days before the expiration of your current period of parole, we may reject or deny your re-parole application without refunding the filing fees. Please note that filing earlier than 180 days before your current parole expiration date will not result in a faster decision. ALERT: Beginning July 1, 2022, we will issue a new travel authorization document to Temporary Protected Status (TPS) beneficiaries: Form I-512T, Authorization for Travel by a Noncitizen to the United States, at our discretion if we find the beneficiary merits this authorization. We will no longer issue advance parole documents as evidence of our prior authorization for a TPS beneficiary to be permitted to reenter the United States if the beneficiary travels outside the United States. Beginning July 1, 2022, we will issue a new travel authorization document to Temporary Protected Status (TPS) beneficiaries: Form I-512T, Authorization for Travel by a Noncitizen to the United States, at our discretion if we find the beneficiary merits this authorization. We will no longer issue advance parole documents as evidence of our prior authorization for a TPS beneficiary to be permitted to reenter the United States if the beneficiary travels outside the United States. If you are a TPS beneficiary with an existing, unexpired advance parole document, you may continue to travel and seek reentry to the United States after a trip outside the United States through the period of validity printed on your advance parole document. If you are a TPS beneficiary applying for a new travel authorization document, you should continue to use Form I-131, Application for Travel Document. If you have a pending Form I-131, you do not need to file a new application. We will continue to issue advance parole documents to noncitizens with pending initial applications for TPS (Form I-821). TPS beneficiaries and individuals with pending initial TPS applications should carefully read the Form I-131 Instructions which contain warnings about certain risks an individual may face if they are outside of the United States while USCIS is considering their TPS reregistration or initial application, such as missing important request for evidence or other notices or being denied TPS while outside the United States. ALERT: Court decisions regarding DACA. On Sept. 13, 2023, the U.S. District Court for the Southern District of Texas issued a decision finding the DACA Final Rule unlawful and expanding the original July 16, 2021, injunction and order of vacatur to cover the Final Rule. However, the court maintained a partial stay of the order for “all DACA recipients who received their initial DACA status prior to July 16, 2021.” See the Memorandum and Order (PDF, 1.35 MB) and Supplemental Order of Injunction (PDF, 72.53 KB). Accordingly, current grants of DACA and related Employment Authorization Documents (EADs) remain valid until they expire, unless individually terminated. In accordance with this decision, USCIS will continue to accept and process DACA renewal requests and accompanying applications for employment authorization under the DACA regulations at 8 CFR 236.22 and 236.23, as it has since October 31, 2022. We will also continue to accept initial DACA requests, but in accordance with the District Court’s order, we will not process initial DACA requests. Current valid grants of DACA and related EADs will continue to be recognized as valid under the Final Rule. This means that individuals with DACA and related EADs do not have to submit a request for DACA or employment authorization until the appropriate time to seek renewal. Please see the DACA Litigation Information Page for important updates and information related to court rulings on the DACA policy. Use this form to apply for a reentry permit, refugee travel document, TPS travel authorization document, advance parole document (including parole into the United States for urgent humanitarian reasons or significant public benefit), or advance permission to travel for Commonwealth of the Northern Mariana Islands (CNMI) long-term residents. For information on travel documents, including potential immigration-related consequences of traveling outside the United States, see our Travel Documents page. If you are in the United States and you have an urgent need to travel outside the United States, see our Expedite Requests page and Emergency Travel page. If you file this form to request an Advance Parole Document authorizing you to seek parole in the United States when you return to the United States after temporary travel abroad, and you depart the United States before we issue your Advance Parole Document, we will consider your Form I-131 abandoned unless you were previously issued an Advance Parole Document that remains valid for the entire time you are outside the United States. If you file this form to request an advance permission to travel for CNMI long-term residents document, and you leave the CNMI without having an advance permission to travel document, your status will automatically terminate.",i-131.pdf,https://www.uscis.gov/sites/default/files/document/forms/i-131.pdf,{'i-131instr.pdf': 'https://www.uscis.gov/sites/default/files/document/forms/i-131instr.pdf'}
I-131A,Application for Carrier Documentation,https://www.uscis.gov/i-131a,False,,"Use this form if you are: Form I-131A allows you to apply for a travel document if you are: We measure the length of your absence from the time you departed the United States to the time you pay the Form I-131A fee. If you are an LPR, you must have been an LPR when you left the United States and still be an LPR when you return to the United States. If you abandoned your LPR status or if we terminated it, do not file Form I-131A. If you are an LPR with an expired Green Card or are traveling with a child under 2 years old, please read the Special Instructions section below to determine whether you need to file Form I-131A. If you were issued a Form I-512T, Advance Parole Document, please read the Special Instructions section below for guidance about how to complete the Form I-131A. Pay Online",i-131a.pdf,https://www.uscis.gov/sites/default/files/document/forms/i-131a.pdf,{'i-131ainstr.pdf': 'https://www.uscis.gov/sites/default/files/document/forms/i-131ainstr.pdf'}
I-134,Declaration of Financial Support,https://www.uscis.gov/i-134,False,,Use this form to agree to provide financial support to a beneficiary of certain immigration benefits for the duration of their temporary stay in the United States. You must file a separate Form I-134 for each beneficiary.,i-134.pdf,https://www.uscis.gov/sites/default/files/document/forms/i-134.pdf,{'i-134instr.pdf': 'https://www.uscis.gov/sites/default/files/document/forms/i-134instr.pdf'}
I-140,Immigrant Petition for Alien Workers,https://www.uscis.gov/i-140,False,,"ALERT: If you are concurrently filing a Form I-140 and Form I-485, do not combine your supporting documents. Clearly separate each package using fasteners or heavy clips to hold together each set. We recommend assembling each form package in the following order: For additional information visit: Tips for Filing Forms by Mail ALERT: At intake, we determine whether the payment you submitted matches the correct fees due. If you do not submit the correct fee, we must reject your form, even if you have submitted an overpayment. The required fees for Form I-129, Form I-129CW, and Form I-140 depend on how you answer the form’s questions about your status as a nonprofit or small employer. See our Web Alert for more information: USCIS Reminds Certain Employment-Based Petitioners to Submit the Correct Required Fees. You can find additional filing fee information by visiting our Filing Fees page, our G-1055, Fee Schedule, and our Frequently Asked Questions on the USCIS Fee Rule page. ALERT: We expanded premium processing services to include certain previously filed and newly filed Form I-140 petitions requesting E13 classification for multinational executives and managers and E21 national interest waiver (NIW) classification. Please see the How Do I Request Premium Processing page for additional information. Use this form to petition for a noncitizen worker to become a permanent resident in the United States.",i-140.pdf,https://www.uscis.gov/sites/default/files/document/forms/i-140.pdf,{'i-140instr.pdf': 'https://www.uscis.gov/sites/default/files/document/forms/i-140instr.pdf'}
I-191,Application for Relief Under Former Section 212(c) of the Immigration and Nationality Act (INA),https://www.uscis.gov/i-191,False,,"Use this form if you are a lawful permanent resident and wish to file for relief under former INA section 212(c). Congress repealed former INA section 212(c) effective April 1, 1997. However, the U.S. Supreme Court decided in 2001 that the repeal does not apply to lawful permanent residents who pleaded guilty to a crime before April 1, 1997 (INS v. St. Cyr, 533 U.S. 289). In Matter of Abdelghany, 26 I&N Dec. 254 (BIA 2014), the Board of Immigration Appeals held that relief under former INA section 212(c) is also available to otherwise eligible lawful permanent residents, even if they were convicted following a trial before April 1, 1997. This form was previously titled, “Application for Advance Permission to Return to Unrelinquished Domicile.”",i-191.pdf,https://www.uscis.gov/sites/default/files/document/forms/i-191.pdf,{'i-191instr.pdf': 'https://www.uscis.gov/sites/default/files/document/forms/i-191instr.pdf'}
I-192,Application for Advance Permission to Enter as a Nonimmigrant,https://www.uscis.gov/i-192,False,,"ALERT: USCIS is working with U.S. Customs and Border Protection and the Department of State to more efficiently facilitate certain employment-based nonimmigrant visas for eligible noncitizens who have graduated from an accredited U.S. institution of higher education. For more information on the process to obtain a 212(d)(3) waiver, please see the DOS Foreign Affairs Manual, Volume 9 and the DOS Easing the Nonimmigrant Visa Process for U.S. College Graduates page. Use this form if you want to apply for advance permission to temporarily enter the United States and you are an: If you are seeking admission under the Visa Waiver Program (VWP) under INA section 217, you cannot file this form. Instead, you must apply for a nonimmigrant visa at a U.S. Embassy or Consulate for authorization to travel. You should contact the appropriate U.S. Embassy or Consulate if you have any questions regarding your admissibility under the VWP.",i-192.pdf,https://www.uscis.gov/sites/default/files/document/forms/i-192.pdf,{'i-192instr.pdf': 'https://www.uscis.gov/sites/default/files/document/forms/i-192instr.pdf'}
I-193,Application for Waiver of Passport and/or Visa,https://www.uscis.gov/i-193,False,,For an alien who is a legal resident of the United States to reenter the United States without the alien's passport and/or visa.,i-193.pdf,https://www.uscis.gov/sites/default/files/document/forms/i-193.pdf,{}
I-212,Application for Permission to Reapply for Admission into the United States After Deportation or Removal,https://www.uscis.gov/i-212,False,,"If you are inadmissible under sections 212(a)(9)(A) or (C) of the Immigration and Nationality Act (INA), use this form to ask for consent to reapply for admission to the United States so you can lawfully return to the United States. Consent to reapply is also called “permission to reapply.”",i-212.pdf,https://www.uscis.gov/sites/default/files/document/forms/i-212.pdf,{'i-212instr.pdf': 'https://www.uscis.gov/sites/default/files/document/forms/i-212instr.pdf'}
I-290B,Notice of Appeal or Motion,https://www.uscis.gov/i-290b,False,,Use this form to file: Do not use this form if you:,i-290b.pdf,https://www.uscis.gov/sites/default/files/document/forms/i-290b.pdf,{'i-290binstr.pdf': 'https://www.uscis.gov/sites/default/files/document/forms/i-290binstr.pdf'}
I-356,Request for Cancellation of Public Charge Bond,https://www.uscis.gov/i-356,False,,"This form should be used to request cancellation of a public charge bond that was submitted on behalf of a noncitizen on Form I-945, Public Charge Bond. Form I-356 can be submitted to request cancellation of the public charge bond by the noncitizen on whose behalf the public charge bond was posted, the noncitizen’s attorney or accredited representative, if any, or, if the noncitizen is deceased, the executor of the noncitizen’s estate. Form I-356 can also be filed by the obligor (the person who posted the bond for the noncitizen) or the obligor’s authorized agent (co-obligor, for surety companies only). For more information about public charge bonds, please see the USCIS Policy Manual, Volume 8, Part G, Public Charge Ground of Inadmissibility.",i-356.pdf,https://www.uscis.gov/sites/default/files/document/forms/i-356.pdf,{'i-356instr.pdf': 'https://www.uscis.gov/sites/default/files/document/forms/i-356instr.pdf'}
I-360,"Petition for Amerasian, Widow(er), or Special Immigrant",https://www.uscis.gov/i-360,False,,"Use this form to classify an alien as: Other classifications not listed above may also be eligible to use Form I-360, Petition for Amerasian, Widow(er), or Special Immigrant. Please read the form instructions for more information.",m-737.pdf,https://www.uscis.gov/sites/default/files/document/forms/m-737.pdf,"{'i-360instr.pdf': 'https://www.uscis.gov/sites/default/files/document/forms/i-360instr.pdf', 'i-360.pdf': 'https://www.uscis.gov/sites/default/files/document/forms/i-360.pdf'}"
I-361,Affidavit of Financial Support and Intent to Petition for Legal Custody for Public Law 97-359 Amerasian,https://www.uscis.gov/i-361,False,,"To be filed in support of Form I-360, Petition to Classify Public Law 97-359 Amerasian as the Child, Son, or Daughter of a United States Citizen. The form is filed as your agreement to provide financial support for a 5-year period for an Amerasian or to petition a court for legal custody of an Amerasian under 18 years of age.",i-361.pdf,https://www.uscis.gov/sites/default/files/document/forms/i-361.pdf,{'i-361instr.pdf': 'https://www.uscis.gov/sites/default/files/document/forms/i-361instr.pdf'}
I-363,Request to Enforce Affidavit of Financial Support and Intent to Petition for Legal Custody for Public Law 97-359 Amerasian,https://www.uscis.gov/i-363,False,,"If, after admission to the United States, the beneficiary of a petition for a Public Law 97-359 Amerasian requires enforcement of the guarantee of financial support and intent to petition for legal custody, which was executed by the beneficiary's sponsor, the beneficiary may file this form with USCIS.",i-363.pdf,https://www.uscis.gov/sites/default/files/document/forms/i-363.pdf,{'i-363instr.pdf': 'https://www.uscis.gov/sites/default/files/document/forms/i-363instr.pdf'}
I-407,Record of Abandonment of Lawful Permanent Resident Status,https://www.uscis.gov/i-407,False,,Use this form to let us know you are voluntarily abandoning your status as a lawful permanent resident (LPR) of the United States. We will update your records to show you are no longer an LPR.,i-407.pdf,https://www.uscis.gov/sites/default/files/document/forms/i-407.pdf,{'i-407instr.pdf': 'https://www.uscis.gov/sites/default/files/document/forms/i-407instr.pdf'}
I-485,Application to Register Permanent Residence or Adjust Status,https://www.uscis.gov/i-485,False,,"Alert: USCIS has prioritized employment-based adjustment of status applications during every step of its processing and adjudication during this fiscal year. We continue to make processing and resource allocation decisions to increase the pace of adjudications and limit the potential for employment-based visa numbers to go unused. If you are applying for a Green Card in an employment-based category and we issued you a Request for Evidence (RFE) for your Form I-693, Report of Medical Examination and Vaccination Record, you should respond as soon as possible so we can finalize a decision on your adjustment application. ALERT: If you are concurrently filing a Form I-140 and Form I-485, do not combine your supporting documents. Clearly separate each package using fasteners or heavy clips to hold together each set. We recommend assembling each form package in the following order: For additional information visit: Tips for Filing Forms by Mail ALERT: Effective April 4, 2024, any Form I-693 that was properly completed and signed by a civil surgeon on or after Nov. 1, 2023, does not expire, and can be used indefinitely as evidence to show that the applicant is not inadmissible on health-related grounds. For more information, see the Policy Alert. ALERT: Below are ways you can help prevent an unnecessary delay in the adjudication of your Form I-485: Below are ways you can help prevent an unnecessary delay in the adjudication of your Form I-485: Submitting all required initial evidence and supporting documentation at the same time you file Form I-485 may eliminate the need for us to issue a Request for Evidence (RFE) to obtain additional evidence and documentation, which may further delay adjudication of your case. If you are required to submit a Form I-693, we cannot approve your Form I-485 without your Form I-693. We generally consider a completed Form I-693 to remain valid for two years after the date the civil surgeon signed it. Use this form to apply for lawful permanent resident status if you are in the United States.",i-485.pdf,https://www.uscis.gov/sites/default/files/document/forms/i-485.pdf,{'i-485instr.pdf': 'https://www.uscis.gov/sites/default/files/document/forms/i-485instr.pdf'}
I-485 Supplement A,"Supplement A to Form I-485, Adjustment of Status Under Section 245(i)",https://www.uscis.gov/i-485supa,False,,Use this form to provide us with additional information if you are requesting to adjust status under section 245(i) of the Immigration and Nationality Act.,i-485supa.pdf,https://www.uscis.gov/sites/default/files/document/forms/i-485supa.pdf,{'i-485supainstr.pdf': 'https://www.uscis.gov/sites/default/files/document/forms/i-485supainstr.pdf'}
I-485 Supplement J,Confirmation of Bona Fide Job Offer or Request for Job Portability Under INA Section 204(j),https://www.uscis.gov/i-485supj,False,,Use Supplement J to:,i-485supj.pdf,https://www.uscis.gov/sites/default/files/document/forms/i-485supj.pdf,{'i-485supjinstr.pdf': 'https://www.uscis.gov/sites/default/files/document/forms/i-485supjinstr.pdf'}
I-508,"Request for Waiver of Certain Rights, Privileges, Exemptions and Immunities",https://www.uscis.gov/i-508,False,,"Use this form to waive certain diplomatic rights privileges, exemptions, and immunities associated with your occupational status (including any exemption from paying U.S. income taxes on the salaries paid to you by your foreign governments or organizations) if you are a non-U.S. citizen working for a foreign government mission or international organization and are employed in an occupational status that would entitle you to A, G or E nonimmigrant status, and are: This form complies with section 247(b) of the Immigration and Nationality Act, as amended (INA). Under section 247(a) of the INA, a Lawful Permanent Resident who is employed in an occupational status that would entitle him or her to A, G or E nonimmigrant status and does not execute Form I-508 shall be adjusted to A, G, or E nonimmigrant status. Similarly, applicants for adjustment of status who do not execute Form I-508 are ineligible to adjust status to permanent resident. ",i-508.pdf,https://www.uscis.gov/sites/default/files/document/forms/i-508.pdf,{'i-508instr.pdf': 'https://www.uscis.gov/sites/default/files/document/forms/i-508instr.pdf'}
I-526,Immigrant Petition by Standalone Investor,https://www.uscis.gov/i-526,False,,"ALERT: Beginning Sept. 1, 2022, we will no longer accept a single, combined fee payment when an applicant or petitioner files Form I-526, Immigrant Petition by Standalone Investor, or Form I-526E, Immigrant Petition by Regional Center Investor, together with Form I-485, Application to Register Permanent Residence or Adjust Status, Form 131, Application for Travel Document, or Form I-765, Application for Employment Authorization. Petitioners must send a separate fee payment for each form. If a petitioner or applicant submits a single, combined fee payment for Forms I-526 or I-526E and the other forms, we will reject the forms for improper fee payment and return the fee. ALERT: Starting July 12, 2022, we are accepting the new Form I-526, Immigrant Petition by a Standalone Investor. Starting July 12, 2022, we are accepting the new Form I-526, Immigrant Petition by a Standalone Investor. We will adjudicate all Forms I-526 filed before March 15, 2022 (the date of the enactment of the EB-5 Reform and Integrity Act of 2022), according to the applicable eligibility requirements at the time the petition was filed. We will continue to process Forms I-526 under the visa availability approach, prioritizing petitions for investors with an available visa or a visa that will be available soon. EB-5 Investors Associated with a Regional Center If you are filing a petition based on the new EB-5 Regional Center Program, then you must submit Form I-526E. USCIS Announces Changes to the EB-5 Program On March 15, 2022, President Biden signed the EB-5 Reform and Integrity Act of 2022, which revised INA 203(b)(5). If you filed Form I-526 before March 15, 2022, we will adjudicate your form under the regulations in effect before Nov. 21, 2019. Please see USCIS Policy Manual, Volume 6, Part G, Investors, for an explanation of those regulations. On June 22, 2021, the U.S. District Court for the Northern District of California, in Behring Regional Center LLC v. Wolf, 20-cv-09263-JSC, vacated (voided) the EB-5 Immigrant Investor Program Modernization Final Rule. Because that rule was voided, the following changes are in effect for petitions filed before March 15, 2022: there is no priority date retention (previously provided in the voided rule), state designations of targeted employment areas are permitted, and the investment amounts are $1 million for standard cases and $500,000 for targeted employment areas. However, for petitions filed after March 15, 2022, the EB-5 Reform and Integrity Act of 2022 raises the investment amounts to $1,050,000 for standard cases and $800,000 for targeted employment areas. The same statute redefines those targeted employment areas. The form is used by a standalone investor to petition USCIS for status as an immigrant to the United States under section 203(b)(5) of the Immigration and Nationality Act (INA), as amended.",i-526.pdf,https://www.uscis.gov/sites/default/files/document/forms/i-526.pdf,{'i-526instr.pdf': 'https://www.uscis.gov/sites/default/files/document/forms/i-526instr.pdf'}
I-526E,Immigrant Petition by Regional Center Investor,https://www.uscis.gov/i-526e,False,,"ALERT: Beginning Sept. 1, 2022, we will no longer accept a single, combined fee payment when an applicant or petitioner files Form I-526, Immigrant Petition by Standalone Investor, or Form I-526E, Immigrant Petition by Regional Center Investor, together with Form I-485, Application to Register Permanent Residence or Adjust Status, Form 131, Application for Travel Document, or Form I-765, Application for Employment Authorization. Petitioners must send a separate fee payment for each form. If a petitioner or applicant submits a single, combined fee payment for Forms I-526 or I-526E and the other forms, we will reject the forms for improper fee payment and return the fee. ALERT: We will reject all Forms I-526 when it indicates that the petitioner’s investment is associated with a regional center. Petitions for classification under INA 203(b)(5)(E) should be submitted on Form I-526E. An investor pooling their investment with one or more qualified immigrants participating in the Regional Center Program uses this form to petition USCIS for status as an immigrant to the United States under section 203(b)(5)(E) of the Immigration and Nationality Act (INA), as amended. A regional center investor may also use Form I-526E to report any amendments necessary to establish ongoing eligibility if the regional center, new commercial enterprise, or job-creating entity in which the investor has invested is terminated or debarred from participation in the Regional Center Program.",i-526e.pdf,https://www.uscis.gov/sites/default/files/document/forms/i-526e.pdf,{'i-526einstr.pdf': 'https://www.uscis.gov/sites/default/files/document/forms/i-526einstr.pdf'}
