Form Number,Form Title,Page URL,Fileable Online,Short Description,Long Description,File Name,File URL,Extra Files
I-90,Application to Replace Permanent Resident Card (Green Card),https://www.uscis.gov/i-90,False,,"Alert: Before sending your package to USCIS, make sure that all the forms you have completed are the current acceptable edition. USCIS published new editions for most forms on April 1, 2024. If you downloaded or printed your forms before April 1, you should verify the current edition date, because we will no longer accept a prior edition. The current acceptable edition can be found under the Edition Date section listed on each form’s webpage. You can also find the edition date at the bottom of the page on the form and instructions. For each form that you are submitting, make sure that all pages are from the same form edition. If any of the form’s pages are from a different form edition, we may reject your form. Watch USCIS Forms: Download the most recent version! to see how to ensure your form is acceptable. For additional guidance on filing paper-based forms at the Lockbox and how to avoid or correct common errors before you file, please visit the Five Steps to File at the USCIS Lockbox webpage. ALERT: On Sept. 26, 2022, we automatically extended the validity of permanent resident cards (also known as Green Cards) to 24 months for lawful permanent residents who file Form I-90. We are in the process of sending out amended receipt notices for individuals with a pending Form I-90. On Sept. 26, 2022, we automatically extended the validity of permanent resident cards (also known as Green Cards) to 24 months for lawful permanent residents who file Form I-90. We are in the process of sending out amended receipt notices for individuals with a pending Form I-90. You can present an amended receipt notice with an expired Green Card as evidence of continued status. By presenting your amended receipt notice with your expired Green Card, you remain authorized to work and travel for 24 months from the expiration date on the front of your expired Green Card. It will take some time to send out all of the amended receipt notices. If you are in urgent need of evidence of status while you wait for your amended receipt notice or your replacement Green Card, or if you need another in-person service, you may call the USCIS Contact Center to request an appointment. We encourage you to wait for your amended receipt notice instead of scheduling an appointment that you may not need. Read more at USCIS Extends Green Card Validity Extension to 24 Months for Green Card Renewals. Use this form to replace your Green Card. Before filing Form I-90, use our Check Naturalization Eligibility tool below to see if you are eligible to become a U.S. citizen. Check Naturalization Eligibility File Online DO NOT submit this form if you are a conditional resident seeking to remove conditions on your Green Card. If you are a conditional resident, you must submit one of the following: Beginning in January 2021, if you are applying to renew your Green Card, your Form I-90 receipt notice (also known as Form I-797) will say the following and can be used with your expired Green Card as evidence of your lawful permanent resident status: This notice provides evidence of your lawful permanent resident status for 12 months from the expiration date on your Form I-551, Permanent Resident Card (also known as a Green Card). You remain authorized to work and travel. This notice, presented with your expired Permanent Resident Card, is evidence of your status and work authorization. If you do not have your Green Card or your card expired more than 12 months ago, you will need evidence of your lawful permanent resident status while waiting to receive a new Green Card, and we may issue you an Alien Documentation, Identification & Telecommunications (ADIT) stamp after you file this form. Additionally, if you applied for naturalization at least six months before your Green Card expired, you may be able to receive an ADIT stamp valid for up to 12 months instead of filing a Form I-90. If you need assistance, contact the USCIS Contact Center. If we already accepted your application to renew your Green Card and you have not been issued a biometrics appointment notice, we will mail you a new receipt notice to use with your expired Green Card as temporary evidence of your lawful permanent resident status. If you do not receive this receipt notice or your notice is lost or damaged and you have a USCIS online account, you can print a copy of the notice for your records. If you need to demonstrate proof of status or have a need to travel, please reach out to our USCIS Contact Center. As a lawful permanent resident, you must have a valid, unexpired Green Card or equivalent documentation with you at all times. Applying for naturalization does not change this requirement.",i-90.pdf,https://www.uscis.gov/sites/default/files/document/forms/i-90.pdf,{'i-90instr.pdf': 'https://www.uscis.gov/sites/default/files/document/forms/i-90instr.pdf'}
I-905,Application for Authorization to Issue Certification for Health Care Workers,https://www.uscis.gov/i-905,False,,Use this form if you work with an organization and want to apply for authorization to issue certificates to health care workers.,i-905.pdf,https://www.uscis.gov/sites/default/files/document/forms/i-905.pdf,{'i-905instr.pdf': 'https://www.uscis.gov/sites/default/files/document/forms/i-905instr.pdf'}
I-907,Request for Premium Processing Service,https://www.uscis.gov/i-907,False,,"ALERT: Effective Feb. 26, 2024, the filing fee for Form I-907, Request for Premium Processing Service, increased to adjust for inflation. If we receive a Form I-907 postmarked on or after Feb. 26 with the incorrect filing fee, we will reject the Form I-907 and return the filing fee. Use this form to request faster processing of: For more information on eligible premium processing categories, please visit our How Do I Request Premium Processing? page. File Online",i-907.pdf,https://www.uscis.gov/sites/default/files/document/forms/i-907.pdf,{'i-907instr.pdf': 'https://www.uscis.gov/sites/default/files/document/forms/i-907instr.pdf'}
I-910,Application for Civil Surgeon Designation,https://www.uscis.gov/i-910,False,,"Alert: Before sending your package to USCIS, make sure that all the forms you have completed are the current acceptable edition. USCIS published new editions for most forms on April 1, 2024. If you downloaded or printed your forms before April 1, you should verify the current edition date, because we will no longer accept a prior edition. The current acceptable edition can be found under the Edition Date section listed on each form’s webpage. You can also find the edition date at the bottom of the page on the form and instructions. For each form that you are submitting, make sure that all pages are from the same form edition. If any of the form’s pages are from a different form edition, we may reject your form. Watch USCIS Forms: Download the most recent version! to see how to ensure your form is acceptable. For additional guidance on filing paper-based forms at the Lockbox and how to avoid or correct common errors before you file, please visit the Five Steps to File at the USCIS Lockbox webpage. Use this form to apply for civil surgeon designation. You do not need to apply for civil surgeon designation if you fall under the limited blanket designations for military physicians and state and local health departments. Please review the Form I-910 Instructions to determine whether you should use this form. For more information, see Volume 8, Part C, Chapter 3 of the USCIS Policy Manual, Blanket Civil Surgeon Designation. USCIS is accepting applications for civil surgeon designation. Applications must be filed in accordance with the instructions for Form I-910. Note that we may exercise discretion in approving civil surgeon designations.",i-910.pdf,https://www.uscis.gov/sites/default/files/document/forms/i-910.pdf,{'i-910instr.pdf': 'https://www.uscis.gov/sites/default/files/document/forms/i-910instr.pdf'}
I-912,Request for Fee Waiver,https://www.uscis.gov/i-912,False,,"Use this form to request a fee waiver (or submit a written request) for certain immigration forms and services based on a demonstrated inability to pay. For the list of forms and services that are eligible for a fee waiver, see the list below, go to our Fee Waiver Page, or read 8 CFR 106.3(a).",i-912.pdf,https://www.uscis.gov/sites/default/files/document/forms/i-912.pdf,{'i-912instr.pdf': 'https://www.uscis.gov/sites/default/files/document/forms/i-912instr.pdf'}
I-914,Application for T Nonimmigrant Status,https://www.uscis.gov/i-914,False,,"ALERT: USCIS Announces Final Rule for T Nonimmigrant Status On April 29, 2024, USCIS announced a final rule amending regulations on applications for T nonimmigrant status. T nonimmigrant status enables certain victims of human trafficking to remain in the United States for an initial period of up to four years. The rule will be effective on Aug. 28, 2024. For more information, see our News Release. Use this form to request temporary immigration benefits if you are a victim of a severe form of trafficking in persons, also known as human trafficking.",i-914.pdf,https://www.uscis.gov/sites/default/files/document/forms/i-914.pdf,"{'i-914supa.pdf': 'https://www.uscis.gov/sites/default/files/document/forms/i-914supa.pdf', 'i-914supb.pdf': 'https://www.uscis.gov/sites/default/files/document/forms/i-914supb.pdf', 'i-914supbinstr.pdf': 'https://www.uscis.gov/sites/default/files/document/forms/i-914supbinstr.pdf', 'i-914instr.pdf': 'https://www.uscis.gov/sites/default/files/document/forms/i-914instr.pdf'}"
I-929,Petition for Qualifying Family Member of a U-1 Nonimmigrant,https://www.uscis.gov/i-929,False,,Use this form to request immigration benefits on behalf of a family member who never held U nonimmigrant status.,i-929.pdf,https://www.uscis.gov/sites/default/files/document/forms/i-929.pdf,{'i-929instr.pdf': 'https://www.uscis.gov/sites/default/files/document/forms/i-929instr.pdf'}
I-941,Application for Entrepreneur Parole,https://www.uscis.gov/i-941,False,,"Alert: Before sending your package to USCIS, make sure that all the forms you have completed are the current acceptable edition. USCIS published new editions for most forms on April 1, 2024. If you downloaded or printed your forms before April 1, you should verify the current edition date, because we will no longer accept a prior edition. The current acceptable edition can be found under the Edition Date section listed on each form’s webpage. You can also find the edition date at the bottom of the page on the form and instructions. For each form that you are submitting, make sure that all pages are from the same form edition. If any of the form’s pages are from a different form edition, we may reject your form. Watch USCIS Forms: Download the most recent version! to see how to ensure your form is acceptable. For additional guidance on filing paper-based forms at the Lockbox and how to avoid or correct common errors before you file, please visit the Five Steps to File at the USCIS Lockbox webpage. Under the International Entrepreneur Rule (IER), the Department of Homeland Security (DHS) may use its authority to grant a period of authorized stay, on a case-by-case basis, to noncitizen entrepreneurs who demonstrate that their stay in the United States would provide a significant public benefit through their business venture and that they merit a favorable exercise of discretion. (This period of authorized stay is technically called “parole.”) Use this form if you are an entrepreneur and want to: Please see the International Entrepreneur Rule page which provides more detailed information and Frequently Asked Questions (FAQs).",i-941.pdf,https://www.uscis.gov/sites/default/files/document/forms/i-941.pdf,{'i-941instr.pdf': 'https://www.uscis.gov/sites/default/files/document/forms/i-941instr.pdf'}
I-945,Public Charge Bond,https://www.uscis.gov/i-945,False,,"If we determine that an applicant is inadmissible based on the public charge ground, but is otherwise admissible, the applicant may be admitted in the discretion of the secretary of homeland security after posting a suitable and proper bond. Before an applicant may post a public charge bond (on Form I-945), we must invite them to do so. The public charge bond is posted as security for performance and fulfillment of the financial obligations of a bonded noncitizen to the U.S. government. For more information about public charge bonds, please see the USCIS Policy Manual, Volume 8, Part G, Public Charge Ground of Inadmissibility.",i-945.pdf,https://www.uscis.gov/sites/default/files/document/forms/i-945.pdf,{'i-945instr.pdf': 'https://www.uscis.gov/sites/default/files/document/forms/i-945instr.pdf'}
I-956,Application for Regional Center Designation,https://www.uscis.gov/i-956,False,,"Alert: Before sending your package to USCIS, make sure that all the forms you have completed are the current acceptable edition. USCIS published new editions for most forms on April 1, 2024. If you downloaded or printed your forms before April 1, you should verify the current edition date, because we will no longer accept a prior edition. The current acceptable edition can be found under the Edition Date section listed on each form’s webpage. You can also find the edition date at the bottom of the page on the form and instructions. For each form that you are submitting, make sure that all pages are from the same form edition. If any of the form’s pages are from a different form edition, we may reject your form. Watch USCIS Forms: Download the most recent version! to see how to ensure your form is acceptable. For additional guidance on filing paper-based forms at the Lockbox and how to avoid or correct common errors before you file, please visit the Five Steps to File at the USCIS Lockbox webpage. ALERT: Starting April 1, 2024, we will no longer accept Form G-1450, Authorization for Credit Card Transactions, when filing Form I-956, Application for Regional Center Designation. You must pay the fee with a money order, personal check, or cashier’s check only, made payable to the U.S. Department of Homeland Security. ALERT: Dec. 29, 2022, is no longer the deadline to file Form I-956, Application for Regional Center Designation, amendments, as required by the Behring Settlement. USCIS is extending this deadline until we publish guidance that clarifies the requirements of these forms. Use Form I-956 to request U.S. Citizenship and Immigration Services (USCIS) designation as a regional center under Immigration and Nationality Act (INA) section 203(b)(5)(E), or to request an amendment to an approved regional center designated under INA 203(b)(5)(E).",i-956.pdf,https://www.uscis.gov/sites/default/files/document/forms/i-956.pdf,{'i-956instr.pdf': 'https://www.uscis.gov/sites/default/files/document/forms/i-956instr.pdf'}
I-956F,Application for Approval of an Investment in a Commercial Enterprise,https://www.uscis.gov/i-956f,False,,"Alert: Before sending your package to USCIS, make sure that all the forms you have completed are the current acceptable edition. USCIS published new editions for most forms on April 1, 2024. If you downloaded or printed your forms before April 1, you should verify the current edition date, because we will no longer accept a prior edition. The current acceptable edition can be found under the Edition Date section listed on each form’s webpage. You can also find the edition date at the bottom of the page on the form and instructions. For each form that you are submitting, make sure that all pages are from the same form edition. If any of the form’s pages are from a different form edition, we may reject your form. Watch USCIS Forms: Download the most recent version! to see how to ensure your form is acceptable. For additional guidance on filing paper-based forms at the Lockbox and how to avoid or correct common errors before you file, please visit the Five Steps to File at the USCIS Lockbox webpage. ALERT: Starting April 1, 2024, we will no longer accept Form G-1450, Authorization for Credit Card Transactions, when filing Form I-956F, Application for Approval of an Investment in a Commercial Enterprise. You must pay the fee with a money order, personal check, or cashier’s check only, made payable to the U.S. Department of Homeland Security. A designated regional center uses this form to request approval of each particular investment offering through an associated new commercial enterprise.",i-956f.pdf,https://www.uscis.gov/sites/default/files/document/forms/i-956f.pdf,{'i-956finstr.pdf': 'https://www.uscis.gov/sites/default/files/document/forms/i-956finstr.pdf'}
I-956G,Regional Center Annual Statement,https://www.uscis.gov/i-956g,False,,"Alert: Before sending your package to USCIS, make sure that all the forms you have completed are the current acceptable edition. USCIS published new editions for most forms on April 1, 2024. If you downloaded or printed your forms before April 1, you should verify the current edition date, because we will no longer accept a prior edition. The current acceptable edition can be found under the Edition Date section listed on each form’s webpage. You can also find the edition date at the bottom of the page on the form and instructions. For each form that you are submitting, make sure that all pages are from the same form edition. If any of the form’s pages are from a different form edition, we may reject your form. Watch USCIS Forms: Download the most recent version! to see how to ensure your form is acceptable. For additional guidance on filing paper-based forms at the Lockbox and how to avoid or correct common errors before you file, please visit the Five Steps to File at the USCIS Lockbox webpage. ALERT: As a reminder, Form I-956G, Regional Center Annual Statement, submissions are due by Dec. 29, 2023. For more information, please see the form instructions (PDF, 187.86 KB). Designated regional centers use this form to provide required information, certifications and evidence to support their continued eligibility for regional center designation.",i-956g.pdf,https://www.uscis.gov/sites/default/files/document/forms/i-956g.pdf,{'i-956ginstr.pdf': 'https://www.uscis.gov/sites/default/files/document/forms/i-956ginstr.pdf'}
I-956H,Bona Fides of Persons Involved with Regional Center Program,https://www.uscis.gov/i-956h,False,,"Alert: Before sending your package to USCIS, make sure that all the forms you have completed are the current acceptable edition. USCIS published new editions for most forms on April 1, 2024. If you downloaded or printed your forms before April 1, you should verify the current edition date, because we will no longer accept a prior edition. The current acceptable edition can be found under the Edition Date section listed on each form’s webpage. You can also find the edition date at the bottom of the page on the form and instructions. For each form that you are submitting, make sure that all pages are from the same form edition. If any of the form’s pages are from a different form edition, we may reject your form. Watch USCIS Forms: Download the most recent version! to see how to ensure your form is acceptable. For additional guidance on filing paper-based forms at the Lockbox and how to avoid or correct common errors before you file, please visit the Five Steps to File at the USCIS Lockbox webpage. Each person involved with a regional center, new commercial enterprise, or affiliated job-creating entity must complete and submit Form I-956H, Bona Fides of Persons Involved with Regional Center Program and the biometric services fee as a distinct filing along with Form I-956, Application for Regional Center Designation, Form I-956F, Application for Approval of Investment in a New Commercial Enterprise, or when persons must otherwise attest to their compliance with section 203(b)(5)(H) of the Immigration and Nationality Act. To ensure accurate and timely processing and avoid potential rejection, each Form I-956H and its biometric services fee should be contained within a separate envelope or folder in the Form I-956 or Form I-956F packet, and clearly identified in a cover letter or memo with the Form I-956 or Form I-956F. The Form I-956 or Form I-956F packet, including any Form I-956H supplements and biometric services fees, should be mailed to the address provided under the Where to File section on the respective pages for those forms. USCIS will reject a form if it is not filed with the appropriate fee, 8 CFR 103.2(a)(7)(ii)(D). NOTE: Do not submit Form I-956H and the biometric services fee as exhibits to Form I-956 or Form I-956F applications or as exhibits in response to a USCIS notice. If you submit Form I-956H and biometric services fee as an exhibit to another filing or response to a USCIS notice, we may reject your associated form and delay processing.",i-956h.pdf,https://www.uscis.gov/sites/default/files/document/forms/i-956h.pdf,{'i-956hinstr.pdf': 'https://www.uscis.gov/sites/default/files/document/forms/i-956hinstr.pdf'}
I-956K,Registration for Direct and Third-Party Promoters,https://www.uscis.gov/i-956k,False,,Each person acting as a direct or third-party promoter (including migration agents) of the following must complete Form I-956K: Each person completing a Form I-956K must answer all questions as indicated on the form.,i-956k.pdf,https://www.uscis.gov/sites/default/files/document/forms/i-956k.pdf,{'i-956kinstr.pdf': 'https://www.uscis.gov/sites/default/files/document/forms/i-956kinstr.pdf'}
N-300,Application to File Declaration of Intention,https://www.uscis.gov/n-300,False,,"Alert: Before sending your package to USCIS, make sure that all the forms you have completed are the current acceptable edition. USCIS published new editions for most forms on April 1, 2024. If you downloaded or printed your forms before April 1, you should verify the current edition date, because we will no longer accept a prior edition. The current acceptable edition can be found under the Edition Date section listed on each form’s webpage. You can also find the edition date at the bottom of the page on the form and instructions. For each form that you are submitting, make sure that all pages are from the same form edition. If any of the form’s pages are from a different form edition, we may reject your form. Watch USCIS Forms: Download the most recent version! to see how to ensure your form is acceptable. For additional guidance on filing paper-based forms at the Lockbox and how to avoid or correct common errors before you file, please visit the Five Steps to File at the USCIS Lockbox webpage. Use this form if you are a permanent resident and want to declare your intent to become a U.S. citizen. This form is not required for naturalization, but some states may require it if you wish to conduct certain business with that state.",n-300.pdf,https://www.uscis.gov/sites/default/files/document/forms/n-300.pdf,{'n-300instr.pdf': 'https://www.uscis.gov/sites/default/files/document/forms/n-300instr.pdf'}
N-336,Request for a Hearing on a Decision in Naturalization Proceedings (Under Section 336 of the INA),https://www.uscis.gov/n-336,False,,"Alert: Before sending your package to USCIS, make sure that all the forms you have completed are the current acceptable edition. USCIS published new editions for most forms on April 1, 2024. If you downloaded or printed your forms before April 1, you should verify the current edition date, because we will no longer accept a prior edition. The current acceptable edition can be found under the Edition Date section listed on each form’s webpage. You can also find the edition date at the bottom of the page on the form and instructions. For each form that you are submitting, make sure that all pages are from the same form edition. If any of the form’s pages are from a different form edition, we may reject your form. Watch USCIS Forms: Download the most recent version! to see how to ensure your form is acceptable. For additional guidance on filing paper-based forms at the Lockbox and how to avoid or correct common errors before you file, please visit the Five Steps to File at the USCIS Lockbox webpage.. Use this form to request a hearing before an immigration officer on our denial of your Form N-400, Application for Naturalization. File Online",n-336.pdf,https://www.uscis.gov/sites/default/files/document/forms/n-336.pdf,{'n-336instr.pdf': 'https://www.uscis.gov/sites/default/files/document/forms/n-336instr.pdf'}
N-400,Application for Naturalization,https://www.uscis.gov/n-400,False,,"Naturalization is the process to become a U.S. citizen if you were born outside of the United States. If you meet certain requirements, you may become a U.S. citizen either at birth or after birth. Use this form to apply for U.S. citizenship. Check your eligibility. File Online Check Naturalization Eligibility",n-400.pdf,https://www.uscis.gov/sites/default/files/document/forms/n-400.pdf,{'n-400instr.pdf': 'https://www.uscis.gov/sites/default/files/document/forms/n-400instr.pdf'}
N-426,Request for Certification of Military or Naval Service,https://www.uscis.gov/n-426,False,,Applicants for naturalization use this form to request that the Department of Defense verify their military or naval service.,n-426.pdf,https://www.uscis.gov/sites/default/files/document/forms/n-426.pdf,{'n-426instr.pdf': 'https://www.uscis.gov/sites/default/files/document/forms/n-426instr.pdf'}
